{
  "$schema": "https://json-schema.org/draft/2020-12/schema",
  "type": "object",
  "additionalProperties": true,
  "title": "SemanticRelationInfo — language 1.10 catalog entry",
  "required": [
    "id",
    "relation_type",
    "from_ref",
    "to_ref",
    "description",
    "scope_refs"
  ],
  "properties": {
    "schema_version": {
      "const": 1
    },
    "id": {
      "type": "string",
      "pattern": "^[A-Za-z_][A-Za-z0-9_]*$"
    },
    "relation_type": {
      "type": "string",
      "pattern": "^[A-Za-z_][A-Za-z0-9_]*$"
    },
    "from_ref": {
      "type": "object",
      "required": [
        "kind",
        "id"
      ],
      "properties": {
        "kind": {
          "type": "string",
          "enum": [
            "world",
            "character",
            "event",
            "scene",
            "storyline",
            "period",
            "state",
            "anchor",
            "tag",
            "asset",
            "variable",
            "file",
            "entity",
            "relation"
          ]
        },
        "id": {
          "type": "string",
          "minLength": 1
        }
      },
      "additionalProperties": true
    },
    "to_ref": {
      "type": "object",
      "required": [
        "kind",
        "id"
      ],
      "properties": {
        "kind": {
          "type": "string",
          "enum": [
            "world",
            "character",
            "event",
            "scene",
            "storyline",
            "period",
            "state",
            "anchor",
            "tag",
            "asset",
            "variable",
            "file",
            "entity",
            "relation"
          ]
        },
        "id": {
          "type": "string",
          "minLength": 1
        }
      },
      "additionalProperties": true
    },
    "description": {
      "type": "string"
    },
    "source_note": {
      "type": [
        "string",
        "null"
      ]
    },
    "scope_refs": {
      "type": "array",
      "items": {
        "type": "object",
        "required": [
          "kind",
          "id"
        ],
        "properties": {
          "kind": {
            "type": "string",
            "enum": [
              "world",
              "character",
              "event",
              "scene",
              "storyline",
              "period",
              "state",
              "anchor",
              "tag",
              "asset",
              "variable",
              "file",
              "entity",
              "relation"
            ]
          },
          "id": {
            "type": "string",
            "minLength": 1
          }
        },
        "additionalProperties": true
      }
    },
    "extensions": {
      "type": "object"
    },
    "properties": {
      "type": "object",
      "additionalProperties": {
        "type": [
          "string",
          "number",
          "boolean"
        ]
      }
    },
    "file": {
      "type": "string"
    },
    "line": {
      "type": "integer",
      "minimum": 1
    }
  },
  "description": "独立关系目录对象。schema_version 由查询外层携带；旧设计样例中的逐项版本字段继续接受。"
}
